<?xml version="1.0" encoding="UTF-8"?><operators xmlns:xsi="http://www.w3.org/2001/XMLSchema-instance" xsi:noNamespaceSchemaLocation="nrlparser.xsd">	<operator>
		<name>donothing</name>
		<completionLevel>DefinedParameterTypes</completionLevel>
		<returnType>
			<type>void</type>
		</returnType>
	</operator>
	<operator>		<name>pass a trade</name>		<parameters>			<parameter>				<name>trade</name>				<type>BasicModel::Main::Trade</type>			</parameter>		</parameters>		<returnType>			<type>void</type>		</returnType>	</operator>	<operator>		<name>pass an integer</name>		<parameters>			<parameter>				<name>int</name>				<type>Integer</type>			</parameter>		</parameters>		<returnType>			<type>void</type>		</returnType>	</operator>	<operator>		<name>pass a leg</name>		<parameters>			<parameter>				<name>leg</name>				<type>BasicModel::Main::IR::IRLeg</type>			</parameter>		</parameters>		<returnType>			<type>void</type>		</returnType>	</operator></operators>