<?xml version="1.0" encoding="UTF-8"?>
<operators xmlns:xsi="http://www.w3.org/2001/XMLSchema-instance" xsi:noNamespaceSchemaLocation="nrlparser.xsd">
	<model>../uml/basicmodel.uml</model>
	<operator>
		<name>Model Test</name>
		<parameters>
			<parameter>
				<name>trade</name>
				<type>BasicModel::Main::Trade</type>
			</parameter>
		</parameters>
		<returnType>
			<type>BasicModel::Main::TradeHeader</type>
		</returnType>
	</operator>
</operators>
